{
  "model_version": "0.1.0",
  "model_family": "inc15c5-education-fy2024-chart-boxes",
  "department_id": "ORG-FED-EXE-DEP-EDUCATION",
  "branch_id": "BR-FED-EXE",
  "prior_canonical_education_crosswalk_id": "INC15-XWALK-ORG-FED-EXE-DEP-EDUCATION",
  "prior_govman_department_source_entity_key": "GOVMAN-2025-12-31:115",
  "original_source_pdf_path": "evidence/education-fy2024/originals/sha256/0af9a9f4e11ddce14fffd467317d9e4c531e9931edb43abcb3ddb8e4fa6291b7.pdf",
  "official_document_title": "FY 2024 Annual Agency Performance Report",
  "official_document_publisher": "U.S. Department of Education",
  "official_report_fiscal_year": "FY2024",
  "publisher_posting_date": "2025-01-15",
  "source_distribution_url": "https://files.eric.ed.gov/fulltext/ED673614.pdf",
  "source_distribution_kind": "official_ED_ERIC_repository_reproduction_not_direct_department_url",
  "source_original_sha256": "0af9a9f4e11ddce14fffd467317d9e4c531e9931edb43abcb3ddb8e4fa6291b7",
  "source_original_git_blob_sha1": "82eb949fa6b61c4483a188f9e75b3e73a86ae49b",
  "source_pdf_physical_pages": 146,
  "physical_pdf_page": 10,
  "printed_page": 5,
  "source_figure_title": "FY 2024 Organization Structure",
  "source_figure_scope": "Department coordinating structure in fiscal year 2024 (not exhaustive legal institution roster)",
  "source_figure_colored_box_count": 19,
  "counted_white_house_initiatives_as_one_aggregate_box": true,
  "individually_named_footnote_initiatives_outside_figure_box_count": 5,
  "previously_modeled_census_candidates_reconciled": 10,
  "previously_unmodeled_figure_labels": 9,
  "previous_census_candidate_ids_replaced": 0,
  "publisher_visual_layout_grouping_only": true,
  "original_direct_edgov_publisher_bytes_verified": false,
  "independently_certified_worm_custody": false,
  "chart_visual_inspection_complete": true,
  "current_department_first_level_denominator": null,
  "independently_qualified_legal_first_level_components": 0,
  "legal_organizational_certification_complete": false,
  "operational_reporting_chain_certified": false,
  "inspector_general_command_subordination_inferred": false,
  "statutory_delegation_certified": false,
  "foreign_quasi_official_govman_entities_promoted_to_ED_offices": false,
  "items": [
    {
      "id": "INC15C5-ED-BOX-01",
      "source_figure_order": 1,
      "source_label": "Office of the Secretary",
      "source_box_left_pt": 245.85,
      "source_box_top_pt": 132.98,
      "source_box_right_pt": 358.65,
      "source_box_bottom_pt": 175.13,
      "source_physical_pdf_page": 10,
      "publisher_display_region": "secretary_root",
      "classification": "departmental_leadership_office_label",
      "prior_census_candidate_id": null,
      "prior_x12_observation_id": null,
      "original_source_govman_entity_id": null,
      "source_layout_only_not_operational_reporting": true,
      "independent_legal_identity_review_complete": false,
      "command_relationship_verified": false,
      "statutory_delegation_verified": false,
      "current_first_level_organization_verified": false
    },
    {
      "id": "INC15C5-ED-BOX-02",
      "source_figure_order": 2,
      "source_label": "White House Initiatives",
      "source_box_left_pt": 377.31,
      "source_box_top_pt": 140.89,
      "source_box_right_pt": 446.15,
      "source_box_bottom_pt": 168.27,
      "source_physical_pdf_page": 10,
      "publisher_display_region": "secretary_side_aggregate",
      "classification": "publisher_group_label_not_single_organization",
      "prior_census_candidate_id": null,
      "prior_x12_observation_id": null,
      "original_source_govman_entity_id": null,
      "source_layout_only_not_operational_reporting": true,
      "independent_legal_identity_review_complete": false,
      "command_relationship_verified": false,
      "statutory_delegation_verified": false,
      "current_first_level_organization_verified": false
    },
    {
      "id": "INC15C5-ED-BOX-03",
      "source_figure_order": 3,
      "source_label": "Office of the Deputy Secretary",
      "source_box_left_pt": 97.75,
      "source_box_top_pt": 194.03,
      "source_box_right_pt": 210.62,
      "source_box_bottom_pt": 224.83,
      "source_physical_pdf_page": 10,
      "publisher_display_region": "deputy_chart_region",
      "classification": "departmental_leadership_office_label",
      "prior_census_candidate_id": null,
      "prior_x12_observation_id": null,
      "original_source_govman_entity_id": null,
      "source_layout_only_not_operational_reporting": true,
      "independent_legal_identity_review_complete": false,
      "command_relationship_verified": false,
      "statutory_delegation_verified": false,
      "current_first_level_organization_verified": false
    },
    {
      "id": "INC15C5-ED-BOX-04",
      "source_figure_order": 4,
      "source_label": "Office of the Under Secretary",
      "source_box_left_pt": 414.14,
      "source_box_top_pt": 194.04,
      "source_box_right_pt": 527.02,
      "source_box_bottom_pt": 224.84,
      "source_physical_pdf_page": 10,
      "publisher_display_region": "under_secretary_chart_region",
      "classification": "departmental_leadership_office_label",
      "prior_census_candidate_id": null,
      "prior_x12_observation_id": null,
      "original_source_govman_entity_id": null,
      "source_layout_only_not_operational_reporting": true,
      "independent_legal_identity_review_complete": false,
      "command_relationship_verified": false,
      "statutory_delegation_verified": false,
      "current_first_level_organization_verified": false
    },
    {
      "id": "INC15C5-ED-BOX-05",
      "source_figure_order": 5,
      "source_label": "Office of Elementary and Secondary Education",
      "source_box_left_pt": 164.35,
      "source_box_top_pt": 232.18,
      "source_box_right_pt": 233.2,
      "source_box_bottom_pt": 287.28,
      "source_physical_pdf_page": 10,
      "publisher_display_region": "deputy_chart_region",
      "classification": "departmental_office_label",
      "prior_census_candidate_id": "CENSUS-COMP-ED-OESE",
      "prior_x12_observation_id": "X12-OBS-CENSUS-COMP-ED-OESE",
      "original_source_govman_entity_id": null,
      "source_layout_only_not_operational_reporting": true,
      "independent_legal_identity_review_complete": false,
      "command_relationship_verified": false,
      "statutory_delegation_verified": false,
      "current_first_level_organization_verified": false
    },
    {
      "id": "INC15C5-ED-BOX-06",
      "source_figure_order": 6,
      "source_label": "Institute of Education Sciences",
      "source_box_left_pt": 255.21,
      "source_box_top_pt": 232.16,
      "source_box_right_pt": 324.05,
      "source_box_bottom_pt": 287.26,
      "source_physical_pdf_page": 10,
      "publisher_display_region": "central_chart_region",
      "classification": "departmental_office_label",
      "prior_census_candidate_id": "CENSUS-COMP-ED-IES",
      "prior_x12_observation_id": "X12-OBS-CENSUS-COMP-ED-IES",
      "original_source_govman_entity_id": null,
      "source_layout_only_not_operational_reporting": true,
      "independent_legal_identity_review_complete": false,
      "command_relationship_verified": false,
      "statutory_delegation_verified": false,
      "current_first_level_organization_verified": false
    },
    {
      "id": "INC15C5-ED-BOX-07",
      "source_figure_order": 7,
      "source_label": "Office of Postsecondary Education",
      "source_box_left_pt": 435.81,
      "source_box_top_pt": 232.19,
      "source_box_right_pt": 504.65,
      "source_box_bottom_pt": 287.29,
      "source_physical_pdf_page": 10,
      "publisher_display_region": "under_secretary_chart_region",
      "classification": "departmental_office_label",
      "prior_census_candidate_id": "CENSUS-COMP-ED-OPE",
      "prior_x12_observation_id": "X12-OBS-CENSUS-COMP-ED-OPE",
      "original_source_govman_entity_id": null,
      "source_layout_only_not_operational_reporting": true,
      "independent_legal_identity_review_complete": false,
      "command_relationship_verified": false,
      "statutory_delegation_verified": false,
      "current_first_level_organization_verified": false
    },
    {
      "id": "INC15C5-ED-BOX-08",
      "source_figure_order": 8,
      "source_label": "Office of Finance and Operations",
      "source_box_left_pt": 74.47,
      "source_box_top_pt": 262.42,
      "source_box_right_pt": 143.32,
      "source_box_bottom_pt": 317.52,
      "source_physical_pdf_page": 10,
      "publisher_display_region": "deputy_chart_region",
      "classification": "departmental_office_label",
      "prior_census_candidate_id": "CENSUS-COMP-ED-OFO",
      "prior_x12_observation_id": "X12-OBS-CENSUS-COMP-ED-OFO",
      "original_source_govman_entity_id": null,
      "source_layout_only_not_operational_reporting": true,
      "independent_legal_identity_review_complete": false,
      "command_relationship_verified": false,
      "statutory_delegation_verified": false,
      "current_first_level_organization_verified": false
    },
    {
      "id": "INC15C5-ED-BOX-09",
      "source_figure_order": 9,
      "source_label": "Office for Civil Rights",
      "source_box_left_pt": 346,
      "source_box_top_pt": 262.39,
      "source_box_right_pt": 414.84,
      "source_box_bottom_pt": 317.49,
      "source_physical_pdf_page": 10,
      "publisher_display_region": "central_chart_region",
      "classification": "departmental_office_label",
      "prior_census_candidate_id": "CENSUS-COMP-ED-OCR",
      "prior_x12_observation_id": "X12-OBS-CENSUS-COMP-ED-OCR",
      "original_source_govman_entity_id": null,
      "source_layout_only_not_operational_reporting": true,
      "independent_legal_identity_review_complete": false,
      "command_relationship_verified": false,
      "statutory_delegation_verified": false,
      "current_first_level_organization_verified": false
    },
    {
      "id": "INC15C5-ED-BOX-10",